{
  "adapter_id": "historical_record_v1",
  "baseline": {
    "accepted_updates": [],
    "compensations": [],
    "format": "ywe.player_aggregate.v2",
    "import_baseline": {
      "consumed_effects": [
        {
          "consequence_ref": "consequence:first",
          "effect": [
            "consequence:first",
            "consequence:first:effect",
            "player:one"
          ],
          "update_ref": "update:first"
        }
      ],
      "consumed_manifestation_event_ids": [],
      "consumed_request_refs": [
        "request:historical:first"
      ],
      "consumed_update_refs": [
        "update:first"
      ],
      "import_anchor": "bfc1d688993025e23c60f7cbe6e386fca5ee1a91597b83a4909089e6d7fa0db9",
      "provenance": {
        "cosmic_pattern_snapshot_ref": "snapshot:player",
        "diagnostic_ref": "diagnostic:player",
        "generation_plan_ref": "plan:player",
        "source_ash_refs": [
          "ash:canonical"
        ]
      },
      "source_sha256": "48db44127c912f4e8ce8ba76b6720dc985ce4133a35869272dabf86ac94733f0"
    },
    "player_id": "player:one",
    "profile_id": "wrw.player_progression.v1",
    "records": {
      "ASH_Cosmological_Model": {
        "document": {
          "category": "source_ash_refs",
          "source_sha256": "af6716d269d8c416002fa5d92ba8cb42159d27a7aed76ac26a80f2827442c73f",
          "subject_id": "player:one",
          "truth_scope": "player_state"
        },
        "kind": "reference",
        "sha256": "9aed8c9b934f54a1e060d17bc403c762434c69d11cab17145a414faf5950af80"
      },
      "ability:latent": {
        "document": {
          "ability_id": "ability:oath",
          "branch_ref": "branch:one",
          "current_state": "latent",
          "history_refs": [],
          "player_id": "player:one",
          "schema_id": "ywe.ability_state.v2",
          "schema_version": "2.0.0",
          "sealed_reason_refs": [],
          "source_refs": [
            "evidence:play"
          ]
        },
        "kind": "ability",
        "sha256": "82c1f3105663b1d3188c2ffc55d966f688a361cef7c4861ed69dad0020bb863d"
      },
      "agent:initial": {
        "document": {
          "agent_id": "agent:initial",
          "agent_kind": "player_mortal_instance",
          "asp_resilience": {
            "asp_diagnostic_refs": [
              "diagnostic:initial"
            ],
            "state_integrity_status": "valid"
          },
          "branch_event_refs": [],
          "choice_capacity_status": "ordinary_choice_capacity",
          "current_leaf_branch_ref": "branch:one",
          "current_location_ref": "location:one",
          "mortal_instance_id": "identity:mortal",
          "recent_action_trace_refs": [],
          "schema_id": "ywe.player_agent_state.v1",
          "schema_version": "0.1.0",
          "self_reference_status": "veiled_self_model"
        },
        "kind": "agent",
        "sha256": "b685991805d51e8cebe993cda0f707d7e07fdcdd4d60221c206cc6b5b0f879a4"
      },
      "axiom_diagnostic.initial": {
        "document": {
          "category": "axiom_diagnostic_refs",
          "source_sha256": "a741717d629d19425fc660b9f8be21e5806b24fa9414aaf93b37b624b6620ed7",
          "subject_id": "player:one",
          "truth_scope": "player_state"
        },
        "kind": "reference",
        "sha256": "57bc662216b4ee3e2f4e9f084d3c9b1830ad0ebf8e40c0912042d1725a40b4f7"
      },
      "bloodline:initial": {
        "document": {
          "schema_id": "ywe.bloodline_resonance_state.v2",
          "schema_version": "2.0.0",
          "signals": [
            {
              "bloodline_id": "lineage:seed",
              "known_publicly": false,
              "revealed_to_player": false,
              "score_q6": 10000,
              "source_refs": [
                "qualified:creation"
              ],
              "stability": "stable",
              "status": "unknown"
            }
          ],
          "source_refs": [
            "qualified:creation"
          ]
        },
        "kind": "bloodline",
        "sha256": "20c6415d75611d4b0e45f6ff3a7825f2d8fb3456e966e5abdfb03d0eca195663"
      },
      "branch:one": {
        "document": {
          "category": "current_leaf_branch_ref",
          "source_sha256": "da5bc8d306614cbdb0fca2eb2b233e872a902e579123549f5aca24f6f7990c9f",
          "subject_id": "branch:one",
          "truth_scope": "leaf_branch_state"
        },
        "kind": "reference",
        "sha256": "27a795402b70a9022a8af33d930729a505a499c88bbed858baeb87176349dbfa"
      },
      "branch_generation_context.initial": {
        "document": {
          "category": "branch_generation_context_refs",
          "source_sha256": "4545412944702b90b2bdaf69f244a779ff45810977debc0b428da0cb77136f96",
          "subject_id": "player:one",
          "truth_scope": "player_state"
        },
        "kind": "reference",
        "sha256": "88bfbadf5530b0b9b3721966424cb623fd6c54db922d7895e63a7747dec7ed56"
      },
      "celestial:suspected": {
        "document": {
          "evidence_refs": [
            "evidence:play"
          ],
          "forbidden": [
            "full_celestial_identity_at_character_creation",
            "identity_reveal_without_provenance"
          ],
          "identity_state": "suspected",
          "known_fragments": [],
          "reveal_status": "player_suspects",
          "schema_id": "ywe.celestial_identity_state.v1",
          "schema_version": "0.1.0"
        },
        "kind": "celestial",
        "sha256": "90fdcfa37be3f3db12a2bb4129e01293be4375ecffc03334db7a0ce8c765c080"
      },
      "consequence:first": {
        "document": {
          "action_refs": [
            "origin:first:action:0",
            "origin:first:action:1"
          ],
          "branch_ref": "branch:one",
          "consequence_id": "consequence:first",
          "effect_id": "consequence:first:effect",
          "external_result_refs": [],
          "player_id": "player:one",
          "update_ref": "update:first"
        },
        "kind": "consequence",
        "sha256": "0151089af436aed47fd60bb091d82915ce6bbf9e908ee24dbdcc11d5bf35db4e"
      },
      "cosmic_pattern_snapshot.initial": {
        "document": {
          "category": "cosmic_pattern_snapshot_ref",
          "source_sha256": "f8134e3022d719647ced6627fe7d7cd67b7683e6e6c09e272f5c025e3bc1ed3a",
          "subject_id": "player:one",
          "truth_scope": "player_state"
        },
        "kind": "reference",
        "sha256": "00bcd227b7f38164549f4b3926fd0165d243fd7756be18e5f0aecb1dbd34528f"
      },
      "diagnostic.initial": {
        "document": {
          "category": "diagnostic_ref",
          "source_sha256": "ca282b15efead24f7d563dcae411e18f68aa5538b1eb1896f94a9c6451b58c6f",
          "subject_id": "player:one",
          "truth_scope": "player_state"
        },
        "kind": "reference",
        "sha256": "7b5a7f9b7769c6dd1239ce7ea7517c5000d6215070d0283a2ae11b23f4a7ebf0"
      },
      "diagnostic:initial": {
        "document": {
          "category": "asp_diagnostic_refs",
          "source_sha256": "fe230b2452afc62c0fe2026f845820d7ea7a4a26f32b0b8ae3df67f3619fa86f",
          "subject_id": "player:one",
          "truth_scope": "player_state"
        },
        "kind": "reference",
        "sha256": "86250504225b0db3d1b6b3c981ef219e3928867c8e76ba1e870964bc08a932f6"
      },
      "existence_potential.player.initial": {
        "document": {
          "category": "existence_potential_ref",
          "source_sha256": "944620f03b593830838a11f112b348e704caa854d70cd57126f04681341d13a7",
          "subject_id": "player:one",
          "truth_scope": "player_state"
        },
        "kind": "reference",
        "sha256": "e56a64ded1f9d4d001e16025b25e2dd2c4404adcb1855aa1b8485d77d30d7ce3"
      },
      "generation:one": {
        "document": {
          "category": "generation_context_refs",
          "source_sha256": "b348477e97a8308b2c6ffa8437a1b3cf3b7cf9e8d865c0e37e55c8f60b120950",
          "subject_id": "player:one",
          "truth_scope": "player_state"
        },
        "kind": "reference",
        "sha256": "e13a42b785a22e360b9ecb2e86914525a35c4882a213708aa254d1fc58ca9589"
      },
      "generation_plan.initial": {
        "document": {
          "category": "generation_plan_ref",
          "source_sha256": "839977f9586f603d7feabd95e9e3f5d81013386120ce375529ccc499a8e13339",
          "subject_id": "player:one",
          "truth_scope": "player_state"
        },
        "kind": "reference",
        "sha256": "40f55ef3404ff5376f9aba222626a84f171b03875dc3dbba2b21b1e221295133"
      },
      "history:initial": {
        "document": {
          "current_leaf_branch_ref": "branch:one",
          "entries": [],
          "player_id": "player:one",
          "schema_id": "ywe.player_branch_history.v1",
          "schema_version": "0.1.0"
        },
        "kind": "branch_history",
        "sha256": "caf9cd9dd223536a0cdfb69fdfe7fb6d43454ea2bd8c75237fd19507c2ec9516"
      },
      "identity:mortal": {
        "document": {
          "category": "mortal_identity_ref",
          "source_sha256": "456f1c6cc5e13afaabe07f09de89432cadec932538c1a479facf3552cb6094a4",
          "subject_id": "player:one",
          "truth_scope": "player_state"
        },
        "kind": "reference",
        "sha256": "27d1b21cf592c40d55cae84f9d2bbafd1955d295b9c39982acd04d423037c509"
      },
      "legacy:memory:one": {
        "document": {
          "category": "narrative_memory_refs",
          "source_sha256": "a75928fd24a45d37d3ec95154cc7887ad094a143871bdde21cbcf7c16db029da",
          "subject_id": "player:one",
          "truth_scope": "player_state"
        },
        "kind": "reference",
        "sha256": "ed6670123fb3059a7dd98d33b515cecdd64b356af842b46039fb57dfc9c84f63"
      },
      "location:one": {
        "document": {
          "category": "current_location_ref",